panel	title	text
1	Literature-anchored modules	Fixed gene sets spanning epithelial/plasticity, antigen-presentation, myeloid, proliferation, and cytolytic programs
2	Fixed scoring	Gene-level z-scores and module means; antigen-presentation/CXCL9/HLA-II composite fixed after framework refinement
3	Evidence across contexts	I-SPY2 internal association; GSE25066_RMA chemotherapy-context assessment; additional NAC cohorts; METABRIC recurrence
4	Biological localization	GSE266919 single-cell data; Myeloid, dendritic-cell, macrophage, and B-cell localization of antigen-presentation programs
boundary	Interpretation boundary	State-decomposition analysis, not a general pCR prediction assay
